{"accepted":false,"authority":"handoff_navigation_and_draft_scaffolding_only","blocker_ids":["CADQ-HOUSING","CADQ-OUTPUT","CADQ-RESIDUAL","CADQ-UNIT","CADQ-FRAME","CADQ-AXIS","CADQ-ORIGIN","CADQ-ZERO","CADQ-DIRECTION","CADQ-ARTICULATION","CADQ-MESH","CADQ-MASS","CADQ-LICENSE"],"integrity":{"record_sha256":"c1bd95160d62a6d35359cf93688bc00a0b23f27c085657d4cb14c9453048dc91"},"packet_id":"intakepacket-581be475bf6fd5274402","packet_kind":"cad_semantic_review","physical_action_permitted":false,"physical_motion_authority":false,"queue_binding":{"item_id":"reviewitem-dec0ef6071c7546de531","queue_id":"reviewqueue-b75d2c9241198e437404","queue_sha256":"fbb5ec19fba2272efa053ca85c974ad9bf6e89ff0dedc6ccdcb72fcd9aa5e357"},"record_state":"generated_draft","schema_version":"myactuator-evidence-intake-packet/1","source_bindings":[{"binding_id":"intakesource-43e107b4cdab2b1e9d85","candidate_only":true,"local_path":"assets/vendor/myactuator/RMD-X/X8-32/vendor/RMD-X8-P9-32-R-电机组合图-B.STEP","occurrence_id":"step-2c9f9a8e81a091988803","redistribution_authority":false,"sha256":"9798fab437ec5d6799c80834a2d5b21cc016b71c9b2f520ee56ddc0655735f1b","source_kind":"vendor_step"},{"binding_id":"intakesource-9f55aa08f5a5b4b03768","candidate_only":true,"local_path":"generated/myactuator/cad/review_packets/step-2c9f9a8e81a091988803/packet.json","occurrence_id":"step-2c9f9a8e81a091988803","redistribution_authority":false,"sha256":"dcb26621d59c25361cff5428934187c488d92c4aa974a84fe1b30e72b15c956c","source_kind":"review_packet"},{"binding_id":"intakesource-98183255fdb363e75b75","candidate_only":true,"local_path":"generated/myactuator/cad/review_packets/step-2c9f9a8e81a091988803/overview.png","occurrence_id":"step-2c9f9a8e81a091988803:overview","redistribution_authority":false,"sha256":"1e515110a83522b88bc3ef31e30e01d4693798c4d191bb0e33cb47a2411a786f","source_kind":"review_image"},{"binding_id":"intakesource-4f6941ee69917ef3555c","candidate_only":true,"local_path":"generated/myactuator/cad/review_packets/step-2c9f9a8e81a091988803/member-sheet.png","occurrence_id":"step-2c9f9a8e81a091988803:sheet","redistribution_authority":false,"sha256":"ae0268a1eb64fa335cf0d675f428416047422135203a86c1e20c0a2105a6e8f1","source_kind":"review_image"}],"subject":{"configuration_id":"cadcfg-c2f77e2997129cb8fff7","model":"X8-32","package_revision":null,"series":"RMD-X","subject_id":"cadcfg-c2f77e2997129cb8fff7","variant_id":"step-2c9f9a8e81a091988803"},"support_granted":false,"tasks":[{"candidate_evidence_refs":[],"candidate_source_ids":["intakesource-43e107b4cdab2b1e9d85","intakesource-9f55aa08f5a5b4b03768","intakesource-98183255fdb363e75b75","intakesource-4f6941ee69917ef3555c"],"canonical_unit":null,"current_state":"unanswered","prompt":"Which exact occurrences, components or reviewed face partition form the fixed housing?","required_evidence_class":"independent_geometry_review","response":null,"response_evidence_refs":[],"task_id":"CADQ-HOUSING","task_kind":"cad_question"},{"candidate_evidence_refs":[],"candidate_source_ids":["intakesource-43e107b4cdab2b1e9d85","intakesource-9f55aa08f5a5b4b03768","intakesource-98183255fdb363e75b75","intakesource-4f6941ee69917ef3555c"],"canonical_unit":null,"current_state":"unanswered","prompt":"Which exact occurrences, components or reviewed face partition form the rotating output?","required_evidence_class":"independent_geometry_review","response":null,"response_evidence_refs":[],"task_id":"CADQ-OUTPUT","task_kind":"cad_question"},{"candidate_evidence_refs":[],"candidate_source_ids":["intakesource-43e107b4cdab2b1e9d85","intakesource-9f55aa08f5a5b4b03768","intakesource-98183255fdb363e75b75","intakesource-4f6941ee69917ef3555c"],"canonical_unit":null,"current_state":"unanswered","prompt":"What is the explicit disposition of every source member not assigned to housing or output?","required_evidence_class":"independent_geometry_review","response":null,"response_evidence_refs":[],"task_id":"CADQ-RESIDUAL","task_kind":"cad_question"},{"candidate_evidence_refs":[],"candidate_source_ids":["intakesource-43e107b4cdab2b1e9d85","intakesource-9f55aa08f5a5b4b03768","intakesource-98183255fdb363e75b75","intakesource-4f6941ee69917ef3555c"],"canonical_unit":null,"current_state":"unanswered","prompt":"What source length unit and exact scale-to-metre transform are evidenced?","required_evidence_class":"independent_geometry_review","response":null,"response_evidence_refs":[],"task_id":"CADQ-UNIT","task_kind":"cad_question"},{"candidate_evidence_refs":[],"candidate_source_ids":["intakesource-43e107b4cdab2b1e9d85","intakesource-9f55aa08f5a5b4b03768","intakesource-98183255fdb363e75b75","intakesource-4f6941ee69917ef3555c"],"canonical_unit":null,"current_state":"unanswered","prompt":"What rigid source-to-canonical transform is evidenced?","required_evidence_class":"independent_geometry_review","response":null,"response_evidence_refs":[],"task_id":"CADQ-FRAME","task_kind":"cad_question"},{"candidate_evidence_refs":[],"candidate_source_ids":["intakesource-43e107b4cdab2b1e9d85","intakesource-9f55aa08f5a5b4b03768","intakesource-98183255fdb363e75b75","intakesource-4f6941ee69917ef3555c"],"canonical_unit":null,"current_state":"unanswered","prompt":"What physical output axis is evidenced and in which source frame is it expressed?","required_evidence_class":"independent_geometry_review","response":null,"response_evidence_refs":[],"task_id":"CADQ-AXIS","task_kind":"cad_question"},{"candidate_evidence_refs":[],"candidate_source_ids":["intakesource-43e107b4cdab2b1e9d85","intakesource-9f55aa08f5a5b4b03768","intakesource-98183255fdb363e75b75","intakesource-4f6941ee69917ef3555c"],"canonical_unit":null,"current_state":"unanswered","prompt":"What physical reference plane or feature defines the output-joint origin?","required_evidence_class":"independent_geometry_review","response":null,"response_evidence_refs":[],"task_id":"CADQ-ORIGIN","task_kind":"cad_question"},{"candidate_evidence_refs":[],"candidate_source_ids":["intakesource-43e107b4cdab2b1e9d85","intakesource-9f55aa08f5a5b4b03768","intakesource-98183255fdb363e75b75","intakesource-4f6941ee69917ef3555c"],"canonical_unit":null,"current_state":"unanswered","prompt":"What physical assembly pose defines zero output angle?","required_evidence_class":"independent_geometry_review","response":null,"response_evidence_refs":[],"task_id":"CADQ-ZERO","task_kind":"cad_question"},{"candidate_evidence_refs":[],"candidate_source_ids":["intakesource-43e107b4cdab2b1e9d85","intakesource-9f55aa08f5a5b4b03768","intakesource-98183255fdb363e75b75","intakesource-4f6941ee69917ef3555c"],"canonical_unit":null,"current_state":"unanswered","prompt":"What evidence defines positive output rotation and its motor/encoder sign relation?","required_evidence_class":"independent_geometry_review","response":null,"response_evidence_refs":[],"task_id":"CADQ-DIRECTION","task_kind":"cad_question"},{"candidate_evidence_refs":[],"candidate_source_ids":["intakesource-43e107b4cdab2b1e9d85","intakesource-9f55aa08f5a5b4b03768","intakesource-98183255fdb363e75b75","intakesource-4f6941ee69917ef3555c"],"canonical_unit":null,"current_state":"unanswered","prompt":"Does the housing remain fixed while only the complete output group articulates over the reviewed range?","required_evidence_class":"independent_geometry_review","response":null,"response_evidence_refs":[],"task_id":"CADQ-ARTICULATION","task_kind":"cad_question"},{"candidate_evidence_refs":[],"candidate_source_ids":["intakesource-43e107b4cdab2b1e9d85","intakesource-9f55aa08f5a5b4b03768","intakesource-98183255fdb363e75b75","intakesource-4f6941ee69917ef3555c"],"canonical_unit":null,"current_state":"unanswered","prompt":"What visual/collision topology, healing and simplification decisions are acceptable?","required_evidence_class":"independent_geometry_review","response":null,"response_evidence_refs":[],"task_id":"CADQ-MESH","task_kind":"cad_question"},{"candidate_evidence_refs":[],"candidate_source_ids":["intakesource-43e107b4cdab2b1e9d85","intakesource-9f55aa08f5a5b4b03768","intakesource-98183255fdb363e75b75","intakesource-4f6941ee69917ef3555c"],"canonical_unit":null,"current_state":"unanswered","prompt":"What qualified source establishes mass, center of mass and inertia for each link?","required_evidence_class":"qualified_mass_property_source","response":null,"response_evidence_refs":[],"task_id":"CADQ-MASS","task_kind":"cad_question"},{"candidate_evidence_refs":[],"candidate_source_ids":["intakesource-43e107b4cdab2b1e9d85","intakesource-9f55aa08f5a5b4b03768","intakesource-98183255fdb363e75b75","intakesource-4f6941ee69917ef3555c"],"canonical_unit":null,"current_state":"unanswered","prompt":"What license or vendor permission governs local and redistributed derived assets?","required_evidence_class":"license_or_vendor_permission","response":null,"response_evidence_refs":[],"task_id":"CADQ-LICENSE","task_kind":"cad_question"}],"workflow":{"assigned":false,"assignment_role_ids":["cad_geometry_reviewer","cad_license_owner"],"controlled_output_directory":"assets/myactuator/cad_decisions","next_action":"Independently review every assembly occurrence, then establish unit, frame, axis, origin, zero and direction.","output_schema":"schemas/myactuator-cad-review-decision.schema.json","readiness":"ready_for_review","submission_preconditions":["Resolve every packet task with exact evidence; blocked lanes first require an independently reviewed partition or replacement native assembly.","Generate a candidate hypothesis and export report before constructing a semantic decision.","Validate the resulting submitted decision with tools/manage_cad_review_decisions.py."]}}
