{"accepted":false,"authority":"handoff_navigation_and_draft_scaffolding_only","blocker_ids":["CADQ-HOUSING","CADQ-OUTPUT","CADQ-RESIDUAL","CADQ-UNIT","CADQ-FRAME","CADQ-AXIS","CADQ-ORIGIN","CADQ-ZERO","CADQ-DIRECTION","CADQ-ARTICULATION","CADQ-MESH","CADQ-MASS","CADQ-LICENSE"],"integrity":{"record_sha256":"904039ca6637bcf5238b200e21647fd814f0049ea5c65ee7ca977ef18bb5f41c"},"packet_id":"intakepacket-ffd9f0f7e3fc4ac0d67f","packet_kind":"cad_semantic_review","physical_action_permitted":false,"physical_motion_authority":false,"queue_binding":{"item_id":"reviewitem-e7cbcc809acd7a0001ec","queue_id":"reviewqueue-b75d2c9241198e437404","queue_sha256":"fbb5ec19fba2272efa053ca85c974ad9bf6e89ff0dedc6ccdcb72fcd9aa5e357"},"record_state":"generated_draft","schema_version":"myactuator-evidence-intake-packet/1","source_bindings":[{"binding_id":"intakesource-8d05011f324d8f7bde0e","candidate_only":true,"local_path":"assets/vendor/myactuator/RMD-L/L-4005/vendor/L-4005-251029/2D3D/RMD-4005三维图/RMD-4005.step","occurrence_id":"step-517e7d1e68c956d417d5","redistribution_authority":false,"sha256":"627c4ba70869a262aadd4d598e57b8e682741e1f8316575401e3b9514f2335d0","source_kind":"vendor_step"},{"binding_id":"intakesource-162a8ec8c811d6ea64b5","candidate_only":true,"local_path":"generated/myactuator/cad/flattened_review_packets/step-517e7d1e68c956d417d5/packet.json","occurrence_id":"step-517e7d1e68c956d417d5","redistribution_authority":false,"sha256":"5fb4c74e9e2ae4908f9cf9165cef062c467083f6da2fc3b2396e9be6dda98705","source_kind":"review_packet"},{"binding_id":"intakesource-8d188b12c460b872c766","candidate_only":true,"local_path":"generated/myactuator/cad/flattened_review_packets/step-517e7d1e68c956d417d5/overview.png","occurrence_id":"step-517e7d1e68c956d417d5:overview","redistribution_authority":false,"sha256":"2cbce001459f5dd5db5ca6e4cdae3e33eaf17c5cc891e1ffd62e6a29d3160a9e","source_kind":"review_image"},{"binding_id":"intakesource-81485c0f51a9c395f80f","candidate_only":true,"local_path":"generated/myactuator/cad/flattened_review_packets/step-517e7d1e68c956d417d5/largest-component-sheet.png","occurrence_id":"step-517e7d1e68c956d417d5:sheet","redistribution_authority":false,"sha256":"9462f541ea6faa23ad6a2f76f9c1f434abe003ea91adfad43b5b1841728b7ba0","source_kind":"review_image"}],"subject":{"configuration_id":"cadcfg-7ffe197ac81bb6f9604a","model":"L-4005","package_revision":null,"series":"RMD-L","subject_id":"cadcfg-7ffe197ac81bb6f9604a","variant_id":"step-517e7d1e68c956d417d5"},"support_granted":false,"tasks":[{"candidate_evidence_refs":[],"candidate_source_ids":["intakesource-8d05011f324d8f7bde0e","intakesource-162a8ec8c811d6ea64b5","intakesource-8d188b12c460b872c766","intakesource-81485c0f51a9c395f80f"],"canonical_unit":null,"current_state":"unanswered","prompt":"Which exact occurrences, components or reviewed face partition form the fixed housing?","required_evidence_class":"independent_geometry_review","response":null,"response_evidence_refs":[],"task_id":"CADQ-HOUSING","task_kind":"cad_question"},{"candidate_evidence_refs":[],"candidate_source_ids":["intakesource-8d05011f324d8f7bde0e","intakesource-162a8ec8c811d6ea64b5","intakesource-8d188b12c460b872c766","intakesource-81485c0f51a9c395f80f"],"canonical_unit":null,"current_state":"unanswered","prompt":"Which exact occurrences, components or reviewed face partition form the rotating output?","required_evidence_class":"independent_geometry_review","response":null,"response_evidence_refs":[],"task_id":"CADQ-OUTPUT","task_kind":"cad_question"},{"candidate_evidence_refs":[],"candidate_source_ids":["intakesource-8d05011f324d8f7bde0e","intakesource-162a8ec8c811d6ea64b5","intakesource-8d188b12c460b872c766","intakesource-81485c0f51a9c395f80f"],"canonical_unit":null,"current_state":"unanswered","prompt":"What is the explicit disposition of every source member not assigned to housing or output?","required_evidence_class":"independent_geometry_review","response":null,"response_evidence_refs":[],"task_id":"CADQ-RESIDUAL","task_kind":"cad_question"},{"candidate_evidence_refs":[],"candidate_source_ids":["intakesource-8d05011f324d8f7bde0e","intakesource-162a8ec8c811d6ea64b5","intakesource-8d188b12c460b872c766","intakesource-81485c0f51a9c395f80f"],"canonical_unit":null,"current_state":"unanswered","prompt":"What source length unit and exact scale-to-metre transform are evidenced?","required_evidence_class":"independent_geometry_review","response":null,"response_evidence_refs":[],"task_id":"CADQ-UNIT","task_kind":"cad_question"},{"candidate_evidence_refs":[],"candidate_source_ids":["intakesource-8d05011f324d8f7bde0e","intakesource-162a8ec8c811d6ea64b5","intakesource-8d188b12c460b872c766","intakesource-81485c0f51a9c395f80f"],"canonical_unit":null,"current_state":"unanswered","prompt":"What rigid source-to-canonical transform is evidenced?","required_evidence_class":"independent_geometry_review","response":null,"response_evidence_refs":[],"task_id":"CADQ-FRAME","task_kind":"cad_question"},{"candidate_evidence_refs":[],"candidate_source_ids":["intakesource-8d05011f324d8f7bde0e","intakesource-162a8ec8c811d6ea64b5","intakesource-8d188b12c460b872c766","intakesource-81485c0f51a9c395f80f"],"canonical_unit":null,"current_state":"unanswered","prompt":"What physical output axis is evidenced and in which source frame is it expressed?","required_evidence_class":"independent_geometry_review","response":null,"response_evidence_refs":[],"task_id":"CADQ-AXIS","task_kind":"cad_question"},{"candidate_evidence_refs":[],"candidate_source_ids":["intakesource-8d05011f324d8f7bde0e","intakesource-162a8ec8c811d6ea64b5","intakesource-8d188b12c460b872c766","intakesource-81485c0f51a9c395f80f"],"canonical_unit":null,"current_state":"unanswered","prompt":"What physical reference plane or feature defines the output-joint origin?","required_evidence_class":"independent_geometry_review","response":null,"response_evidence_refs":[],"task_id":"CADQ-ORIGIN","task_kind":"cad_question"},{"candidate_evidence_refs":[],"candidate_source_ids":["intakesource-8d05011f324d8f7bde0e","intakesource-162a8ec8c811d6ea64b5","intakesource-8d188b12c460b872c766","intakesource-81485c0f51a9c395f80f"],"canonical_unit":null,"current_state":"unanswered","prompt":"What physical assembly pose defines zero output angle?","required_evidence_class":"independent_geometry_review","response":null,"response_evidence_refs":[],"task_id":"CADQ-ZERO","task_kind":"cad_question"},{"candidate_evidence_refs":[],"candidate_source_ids":["intakesource-8d05011f324d8f7bde0e","intakesource-162a8ec8c811d6ea64b5","intakesource-8d188b12c460b872c766","intakesource-81485c0f51a9c395f80f"],"canonical_unit":null,"current_state":"unanswered","prompt":"What evidence defines positive output rotation and its motor/encoder sign relation?","required_evidence_class":"independent_geometry_review","response":null,"response_evidence_refs":[],"task_id":"CADQ-DIRECTION","task_kind":"cad_question"},{"candidate_evidence_refs":[],"candidate_source_ids":["intakesource-8d05011f324d8f7bde0e","intakesource-162a8ec8c811d6ea64b5","intakesource-8d188b12c460b872c766","intakesource-81485c0f51a9c395f80f"],"canonical_unit":null,"current_state":"unanswered","prompt":"Does the housing remain fixed while only the complete output group articulates over the reviewed range?","required_evidence_class":"independent_geometry_review","response":null,"response_evidence_refs":[],"task_id":"CADQ-ARTICULATION","task_kind":"cad_question"},{"candidate_evidence_refs":[],"candidate_source_ids":["intakesource-8d05011f324d8f7bde0e","intakesource-162a8ec8c811d6ea64b5","intakesource-8d188b12c460b872c766","intakesource-81485c0f51a9c395f80f"],"canonical_unit":null,"current_state":"unanswered","prompt":"What visual/collision topology, healing and simplification decisions are acceptable?","required_evidence_class":"independent_geometry_review","response":null,"response_evidence_refs":[],"task_id":"CADQ-MESH","task_kind":"cad_question"},{"candidate_evidence_refs":[],"candidate_source_ids":["intakesource-8d05011f324d8f7bde0e","intakesource-162a8ec8c811d6ea64b5","intakesource-8d188b12c460b872c766","intakesource-81485c0f51a9c395f80f"],"canonical_unit":null,"current_state":"unanswered","prompt":"What qualified source establishes mass, center of mass and inertia for each link?","required_evidence_class":"qualified_mass_property_source","response":null,"response_evidence_refs":[],"task_id":"CADQ-MASS","task_kind":"cad_question"},{"candidate_evidence_refs":[],"candidate_source_ids":["intakesource-8d05011f324d8f7bde0e","intakesource-162a8ec8c811d6ea64b5","intakesource-8d188b12c460b872c766","intakesource-81485c0f51a9c395f80f"],"canonical_unit":null,"current_state":"unanswered","prompt":"What license or vendor permission governs local and redistributed derived assets?","required_evidence_class":"license_or_vendor_permission","response":null,"response_evidence_refs":[],"task_id":"CADQ-LICENSE","task_kind":"cad_question"}],"workflow":{"assigned":false,"assignment_role_ids":["cad_geometry_reviewer","cad_license_owner"],"controlled_output_directory":"assets/myactuator/cad_decisions","next_action":"Independently assign every stable component to housing, output or an explicit residual disposition.","output_schema":"schemas/myactuator-cad-review-decision.schema.json","readiness":"ready_for_review","submission_preconditions":["Resolve every packet task with exact evidence; blocked lanes first require an independently reviewed partition or replacement native assembly.","Generate a candidate hypothesis and export report before constructing a semantic decision.","Validate the resulting submitted decision with tools/manage_cad_review_decisions.py."]}}
