{"accepted":false,"authority":"handoff_navigation_and_draft_scaffolding_only","blocker_ids":["CADQ-HOUSING","CADQ-OUTPUT","CADQ-RESIDUAL","CADQ-UNIT","CADQ-FRAME","CADQ-AXIS","CADQ-ORIGIN","CADQ-ZERO","CADQ-DIRECTION","CADQ-ARTICULATION","CADQ-MESH","CADQ-MASS","CADQ-LICENSE"],"integrity":{"record_sha256":"b9fd2e21613bef8bf93931df28325cb4bc6454acfdf45847e9970bfb315e21e9"},"packet_id":"intakepacket-c03d2f688c8c68d29f2f","packet_kind":"cad_semantic_review","physical_action_permitted":false,"physical_motion_authority":false,"queue_binding":{"item_id":"reviewitem-363950c7fe07bcb430e6","queue_id":"reviewqueue-b75d2c9241198e437404","queue_sha256":"fbb5ec19fba2272efa053ca85c974ad9bf6e89ff0dedc6ccdcb72fcd9aa5e357"},"record_state":"generated_draft","schema_version":"myactuator-evidence-intake-packet/1","source_bindings":[{"binding_id":"intakesource-200397db795199214ce5","candidate_only":true,"local_path":"assets/vendor/myactuator/RMD-X/X4-36/vendor/RMD-X4-P36-36 电机组合图-A0.STEP","occurrence_id":"step-a445ee72b425d35404f4","redistribution_authority":false,"sha256":"c20260bf8faf780d9bdd4599f7cc973bf42951f683b1b953af6082ff7c5ef51c","source_kind":"vendor_step"},{"binding_id":"intakesource-f730ca95caeb5ffaef80","candidate_only":true,"local_path":"generated/myactuator/cad/review_packets/step-a445ee72b425d35404f4/packet.json","occurrence_id":"step-a445ee72b425d35404f4","redistribution_authority":false,"sha256":"193fd93deb3c7aa63e96a9c82a2b16d2f07738b5c230b616aec055821ccd6c5e","source_kind":"review_packet"},{"binding_id":"intakesource-7021b163287d1b464203","candidate_only":true,"local_path":"generated/myactuator/cad/review_packets/step-a445ee72b425d35404f4/overview.png","occurrence_id":"step-a445ee72b425d35404f4:overview","redistribution_authority":false,"sha256":"17da4ddef75b3ed9d4e42273797c89c8bc68118c803349267352ef6656b7e708","source_kind":"review_image"},{"binding_id":"intakesource-5b0058a1890bcd61cec2","candidate_only":true,"local_path":"generated/myactuator/cad/review_packets/step-a445ee72b425d35404f4/member-sheet.png","occurrence_id":"step-a445ee72b425d35404f4:sheet","redistribution_authority":false,"sha256":"7bfebd1b9f5070f1358e12e73ce1b0c3e0a02a9ce90ef871defff8e2861a4867","source_kind":"review_image"}],"subject":{"configuration_id":"cadcfg-397c310529f1989a6d3a","model":"X4-36","package_revision":null,"series":"RMD-X","subject_id":"cadcfg-397c310529f1989a6d3a","variant_id":"step-a445ee72b425d35404f4"},"support_granted":false,"tasks":[{"candidate_evidence_refs":[],"candidate_source_ids":["intakesource-200397db795199214ce5","intakesource-f730ca95caeb5ffaef80","intakesource-7021b163287d1b464203","intakesource-5b0058a1890bcd61cec2"],"canonical_unit":null,"current_state":"unanswered","prompt":"Which exact occurrences, components or reviewed face partition form the fixed housing?","required_evidence_class":"independent_geometry_review","response":null,"response_evidence_refs":[],"task_id":"CADQ-HOUSING","task_kind":"cad_question"},{"candidate_evidence_refs":[],"candidate_source_ids":["intakesource-200397db795199214ce5","intakesource-f730ca95caeb5ffaef80","intakesource-7021b163287d1b464203","intakesource-5b0058a1890bcd61cec2"],"canonical_unit":null,"current_state":"unanswered","prompt":"Which exact occurrences, components or reviewed face partition form the rotating output?","required_evidence_class":"independent_geometry_review","response":null,"response_evidence_refs":[],"task_id":"CADQ-OUTPUT","task_kind":"cad_question"},{"candidate_evidence_refs":[],"candidate_source_ids":["intakesource-200397db795199214ce5","intakesource-f730ca95caeb5ffaef80","intakesource-7021b163287d1b464203","intakesource-5b0058a1890bcd61cec2"],"canonical_unit":null,"current_state":"unanswered","prompt":"What is the explicit disposition of every source member not assigned to housing or output?","required_evidence_class":"independent_geometry_review","response":null,"response_evidence_refs":[],"task_id":"CADQ-RESIDUAL","task_kind":"cad_question"},{"candidate_evidence_refs":[],"candidate_source_ids":["intakesource-200397db795199214ce5","intakesource-f730ca95caeb5ffaef80","intakesource-7021b163287d1b464203","intakesource-5b0058a1890bcd61cec2"],"canonical_unit":null,"current_state":"unanswered","prompt":"What source length unit and exact scale-to-metre transform are evidenced?","required_evidence_class":"independent_geometry_review","response":null,"response_evidence_refs":[],"task_id":"CADQ-UNIT","task_kind":"cad_question"},{"candidate_evidence_refs":[],"candidate_source_ids":["intakesource-200397db795199214ce5","intakesource-f730ca95caeb5ffaef80","intakesource-7021b163287d1b464203","intakesource-5b0058a1890bcd61cec2"],"canonical_unit":null,"current_state":"unanswered","prompt":"What rigid source-to-canonical transform is evidenced?","required_evidence_class":"independent_geometry_review","response":null,"response_evidence_refs":[],"task_id":"CADQ-FRAME","task_kind":"cad_question"},{"candidate_evidence_refs":[],"candidate_source_ids":["intakesource-200397db795199214ce5","intakesource-f730ca95caeb5ffaef80","intakesource-7021b163287d1b464203","intakesource-5b0058a1890bcd61cec2"],"canonical_unit":null,"current_state":"unanswered","prompt":"What physical output axis is evidenced and in which source frame is it expressed?","required_evidence_class":"independent_geometry_review","response":null,"response_evidence_refs":[],"task_id":"CADQ-AXIS","task_kind":"cad_question"},{"candidate_evidence_refs":[],"candidate_source_ids":["intakesource-200397db795199214ce5","intakesource-f730ca95caeb5ffaef80","intakesource-7021b163287d1b464203","intakesource-5b0058a1890bcd61cec2"],"canonical_unit":null,"current_state":"unanswered","prompt":"What physical reference plane or feature defines the output-joint origin?","required_evidence_class":"independent_geometry_review","response":null,"response_evidence_refs":[],"task_id":"CADQ-ORIGIN","task_kind":"cad_question"},{"candidate_evidence_refs":[],"candidate_source_ids":["intakesource-200397db795199214ce5","intakesource-f730ca95caeb5ffaef80","intakesource-7021b163287d1b464203","intakesource-5b0058a1890bcd61cec2"],"canonical_unit":null,"current_state":"unanswered","prompt":"What physical assembly pose defines zero output angle?","required_evidence_class":"independent_geometry_review","response":null,"response_evidence_refs":[],"task_id":"CADQ-ZERO","task_kind":"cad_question"},{"candidate_evidence_refs":[],"candidate_source_ids":["intakesource-200397db795199214ce5","intakesource-f730ca95caeb5ffaef80","intakesource-7021b163287d1b464203","intakesource-5b0058a1890bcd61cec2"],"canonical_unit":null,"current_state":"unanswered","prompt":"What evidence defines positive output rotation and its motor/encoder sign relation?","required_evidence_class":"independent_geometry_review","response":null,"response_evidence_refs":[],"task_id":"CADQ-DIRECTION","task_kind":"cad_question"},{"candidate_evidence_refs":[],"candidate_source_ids":["intakesource-200397db795199214ce5","intakesource-f730ca95caeb5ffaef80","intakesource-7021b163287d1b464203","intakesource-5b0058a1890bcd61cec2"],"canonical_unit":null,"current_state":"unanswered","prompt":"Does the housing remain fixed while only the complete output group articulates over the reviewed range?","required_evidence_class":"independent_geometry_review","response":null,"response_evidence_refs":[],"task_id":"CADQ-ARTICULATION","task_kind":"cad_question"},{"candidate_evidence_refs":[],"candidate_source_ids":["intakesource-200397db795199214ce5","intakesource-f730ca95caeb5ffaef80","intakesource-7021b163287d1b464203","intakesource-5b0058a1890bcd61cec2"],"canonical_unit":null,"current_state":"unanswered","prompt":"What visual/collision topology, healing and simplification decisions are acceptable?","required_evidence_class":"independent_geometry_review","response":null,"response_evidence_refs":[],"task_id":"CADQ-MESH","task_kind":"cad_question"},{"candidate_evidence_refs":[],"candidate_source_ids":["intakesource-200397db795199214ce5","intakesource-f730ca95caeb5ffaef80","intakesource-7021b163287d1b464203","intakesource-5b0058a1890bcd61cec2"],"canonical_unit":null,"current_state":"unanswered","prompt":"What qualified source establishes mass, center of mass and inertia for each link?","required_evidence_class":"qualified_mass_property_source","response":null,"response_evidence_refs":[],"task_id":"CADQ-MASS","task_kind":"cad_question"},{"candidate_evidence_refs":[],"candidate_source_ids":["intakesource-200397db795199214ce5","intakesource-f730ca95caeb5ffaef80","intakesource-7021b163287d1b464203","intakesource-5b0058a1890bcd61cec2"],"canonical_unit":null,"current_state":"unanswered","prompt":"What license or vendor permission governs local and redistributed derived assets?","required_evidence_class":"license_or_vendor_permission","response":null,"response_evidence_refs":[],"task_id":"CADQ-LICENSE","task_kind":"cad_question"}],"workflow":{"assigned":false,"assignment_role_ids":["cad_geometry_reviewer","cad_license_owner"],"controlled_output_directory":"assets/myactuator/cad_decisions","next_action":"Independently review every assembly occurrence, then establish unit, frame, axis, origin, zero and direction.","output_schema":"schemas/myactuator-cad-review-decision.schema.json","readiness":"ready_for_review","submission_preconditions":["Resolve every packet task with exact evidence; blocked lanes first require an independently reviewed partition or replacement native assembly.","Generate a candidate hypothesis and export report before constructing a semantic decision.","Validate the resulting submitted decision with tools/manage_cad_review_decisions.py."]}}
