{"accepted":false,"authority":"handoff_navigation_and_draft_scaffolding_only","blocker_ids":["CADQ-HOUSING","CADQ-OUTPUT","CADQ-RESIDUAL","CADQ-UNIT","CADQ-FRAME","CADQ-AXIS","CADQ-ORIGIN","CADQ-ZERO","CADQ-DIRECTION","CADQ-ARTICULATION","CADQ-MESH","CADQ-MASS","CADQ-LICENSE"],"integrity":{"record_sha256":"b23408ec3cde8e60bd43e2eb5d921b35671140835e9a46ac14eb306e88d43278"},"packet_id":"intakepacket-f864e217eaf4a226e07f","packet_kind":"cad_semantic_review","physical_action_permitted":false,"physical_motion_authority":false,"queue_binding":{"item_id":"reviewitem-f52d621c15fb2d691e52","queue_id":"reviewqueue-b75d2c9241198e437404","queue_sha256":"fbb5ec19fba2272efa053ca85c974ad9bf6e89ff0dedc6ccdcb72fcd9aa5e357"},"record_state":"generated_draft","schema_version":"myactuator-evidence-intake-packet/1","source_bindings":[{"binding_id":"intakesource-42ba877a33171d79acb8","candidate_only":true,"local_path":"assets/vendor/myactuator/FL-FLO/FL-38-08/vendor/FL-38-08-250403/FL-38-08.STEP","occurrence_id":"step-f5f72951b3f77ce16c91","redistribution_authority":false,"sha256":"f1abae74d6bf7cbb9a336c03066cd10bd1369019b78643384a2855b67fd82ea1","source_kind":"vendor_step"},{"binding_id":"intakesource-528db724b3cf27ea957c","candidate_only":true,"local_path":"generated/myactuator/cad/flattened_review_packets/step-f5f72951b3f77ce16c91/packet.json","occurrence_id":"step-f5f72951b3f77ce16c91","redistribution_authority":false,"sha256":"3e6f64b12cab597402574cfb77dab308032e326e91c4807a8b14993cb1d8b961","source_kind":"review_packet"},{"binding_id":"intakesource-37caf78c834361ebebd8","candidate_only":true,"local_path":"generated/myactuator/cad/flattened_review_packets/step-f5f72951b3f77ce16c91/overview.png","occurrence_id":"step-f5f72951b3f77ce16c91:overview","redistribution_authority":false,"sha256":"5eb7419bb1f2be932261b148141e0f235fb7a83f1e3f7b5607834925dbbc7ff4","source_kind":"review_image"},{"binding_id":"intakesource-b0e900c080312096fb96","candidate_only":true,"local_path":"generated/myactuator/cad/flattened_review_packets/step-f5f72951b3f77ce16c91/largest-component-sheet.png","occurrence_id":"step-f5f72951b3f77ce16c91:sheet","redistribution_authority":false,"sha256":"c206adee77968e040de9a8fc19ca30359e9e894eb9284974944859cad7cc67ad","source_kind":"review_image"}],"subject":{"configuration_id":"cadcfg-e9c45a42638e5ddd84d5","model":"FL-38-08","package_revision":null,"series":"FL-FLO","subject_id":"cadcfg-e9c45a42638e5ddd84d5","variant_id":"step-f5f72951b3f77ce16c91"},"support_granted":false,"tasks":[{"candidate_evidence_refs":[],"candidate_source_ids":["intakesource-42ba877a33171d79acb8","intakesource-528db724b3cf27ea957c","intakesource-37caf78c834361ebebd8","intakesource-b0e900c080312096fb96"],"canonical_unit":null,"current_state":"unanswered","prompt":"Which exact occurrences, components or reviewed face partition form the fixed housing?","required_evidence_class":"independent_geometry_review","response":null,"response_evidence_refs":[],"task_id":"CADQ-HOUSING","task_kind":"cad_question"},{"candidate_evidence_refs":[],"candidate_source_ids":["intakesource-42ba877a33171d79acb8","intakesource-528db724b3cf27ea957c","intakesource-37caf78c834361ebebd8","intakesource-b0e900c080312096fb96"],"canonical_unit":null,"current_state":"unanswered","prompt":"Which exact occurrences, components or reviewed face partition form the rotating output?","required_evidence_class":"independent_geometry_review","response":null,"response_evidence_refs":[],"task_id":"CADQ-OUTPUT","task_kind":"cad_question"},{"candidate_evidence_refs":[],"candidate_source_ids":["intakesource-42ba877a33171d79acb8","intakesource-528db724b3cf27ea957c","intakesource-37caf78c834361ebebd8","intakesource-b0e900c080312096fb96"],"canonical_unit":null,"current_state":"unanswered","prompt":"What is the explicit disposition of every source member not assigned to housing or output?","required_evidence_class":"independent_geometry_review","response":null,"response_evidence_refs":[],"task_id":"CADQ-RESIDUAL","task_kind":"cad_question"},{"candidate_evidence_refs":[],"candidate_source_ids":["intakesource-42ba877a33171d79acb8","intakesource-528db724b3cf27ea957c","intakesource-37caf78c834361ebebd8","intakesource-b0e900c080312096fb96"],"canonical_unit":null,"current_state":"unanswered","prompt":"What source length unit and exact scale-to-metre transform are evidenced?","required_evidence_class":"independent_geometry_review","response":null,"response_evidence_refs":[],"task_id":"CADQ-UNIT","task_kind":"cad_question"},{"candidate_evidence_refs":[],"candidate_source_ids":["intakesource-42ba877a33171d79acb8","intakesource-528db724b3cf27ea957c","intakesource-37caf78c834361ebebd8","intakesource-b0e900c080312096fb96"],"canonical_unit":null,"current_state":"unanswered","prompt":"What rigid source-to-canonical transform is evidenced?","required_evidence_class":"independent_geometry_review","response":null,"response_evidence_refs":[],"task_id":"CADQ-FRAME","task_kind":"cad_question"},{"candidate_evidence_refs":[],"candidate_source_ids":["intakesource-42ba877a33171d79acb8","intakesource-528db724b3cf27ea957c","intakesource-37caf78c834361ebebd8","intakesource-b0e900c080312096fb96"],"canonical_unit":null,"current_state":"unanswered","prompt":"What physical output axis is evidenced and in which source frame is it expressed?","required_evidence_class":"independent_geometry_review","response":null,"response_evidence_refs":[],"task_id":"CADQ-AXIS","task_kind":"cad_question"},{"candidate_evidence_refs":[],"candidate_source_ids":["intakesource-42ba877a33171d79acb8","intakesource-528db724b3cf27ea957c","intakesource-37caf78c834361ebebd8","intakesource-b0e900c080312096fb96"],"canonical_unit":null,"current_state":"unanswered","prompt":"What physical reference plane or feature defines the output-joint origin?","required_evidence_class":"independent_geometry_review","response":null,"response_evidence_refs":[],"task_id":"CADQ-ORIGIN","task_kind":"cad_question"},{"candidate_evidence_refs":[],"candidate_source_ids":["intakesource-42ba877a33171d79acb8","intakesource-528db724b3cf27ea957c","intakesource-37caf78c834361ebebd8","intakesource-b0e900c080312096fb96"],"canonical_unit":null,"current_state":"unanswered","prompt":"What physical assembly pose defines zero output angle?","required_evidence_class":"independent_geometry_review","response":null,"response_evidence_refs":[],"task_id":"CADQ-ZERO","task_kind":"cad_question"},{"candidate_evidence_refs":[],"candidate_source_ids":["intakesource-42ba877a33171d79acb8","intakesource-528db724b3cf27ea957c","intakesource-37caf78c834361ebebd8","intakesource-b0e900c080312096fb96"],"canonical_unit":null,"current_state":"unanswered","prompt":"What evidence defines positive output rotation and its motor/encoder sign relation?","required_evidence_class":"independent_geometry_review","response":null,"response_evidence_refs":[],"task_id":"CADQ-DIRECTION","task_kind":"cad_question"},{"candidate_evidence_refs":[],"candidate_source_ids":["intakesource-42ba877a33171d79acb8","intakesource-528db724b3cf27ea957c","intakesource-37caf78c834361ebebd8","intakesource-b0e900c080312096fb96"],"canonical_unit":null,"current_state":"unanswered","prompt":"Does the housing remain fixed while only the complete output group articulates over the reviewed range?","required_evidence_class":"independent_geometry_review","response":null,"response_evidence_refs":[],"task_id":"CADQ-ARTICULATION","task_kind":"cad_question"},{"candidate_evidence_refs":[],"candidate_source_ids":["intakesource-42ba877a33171d79acb8","intakesource-528db724b3cf27ea957c","intakesource-37caf78c834361ebebd8","intakesource-b0e900c080312096fb96"],"canonical_unit":null,"current_state":"unanswered","prompt":"What visual/collision topology, healing and simplification decisions are acceptable?","required_evidence_class":"independent_geometry_review","response":null,"response_evidence_refs":[],"task_id":"CADQ-MESH","task_kind":"cad_question"},{"candidate_evidence_refs":[],"candidate_source_ids":["intakesource-42ba877a33171d79acb8","intakesource-528db724b3cf27ea957c","intakesource-37caf78c834361ebebd8","intakesource-b0e900c080312096fb96"],"canonical_unit":null,"current_state":"unanswered","prompt":"What qualified source establishes mass, center of mass and inertia for each link?","required_evidence_class":"qualified_mass_property_source","response":null,"response_evidence_refs":[],"task_id":"CADQ-MASS","task_kind":"cad_question"},{"candidate_evidence_refs":[],"candidate_source_ids":["intakesource-42ba877a33171d79acb8","intakesource-528db724b3cf27ea957c","intakesource-37caf78c834361ebebd8","intakesource-b0e900c080312096fb96"],"canonical_unit":null,"current_state":"unanswered","prompt":"What license or vendor permission governs local and redistributed derived assets?","required_evidence_class":"license_or_vendor_permission","response":null,"response_evidence_refs":[],"task_id":"CADQ-LICENSE","task_kind":"cad_question"}],"workflow":{"assigned":false,"assignment_role_ids":["cad_geometry_reviewer","cad_license_owner"],"controlled_output_directory":"assets/myactuator/cad_decisions","next_action":"Independently assign every stable component to housing, output or an explicit residual disposition.","output_schema":"schemas/myactuator-cad-review-decision.schema.json","readiness":"ready_for_review","submission_preconditions":["Resolve every packet task with exact evidence; blocked lanes first require an independently reviewed partition or replacement native assembly.","Generate a candidate hypothesis and export report before constructing a semantic decision.","Validate the resulting submitted decision with tools/manage_cad_review_decisions.py."]}}
