{"accepted":false,"authority":"handoff_navigation_and_draft_scaffolding_only","blocker_ids":["CADQ-HOUSING","CADQ-OUTPUT","CADQ-RESIDUAL","CADQ-UNIT","CADQ-FRAME","CADQ-AXIS","CADQ-ORIGIN","CADQ-ZERO","CADQ-DIRECTION","CADQ-ARTICULATION","CADQ-MESH","CADQ-MASS","CADQ-LICENSE"],"integrity":{"record_sha256":"eb1aff96476814436a69395ca702e84f59e9ef2d4e4c2257e4abceaba6c776e8"},"packet_id":"intakepacket-59ae6c14aefd5e520431","packet_kind":"cad_semantic_review","physical_action_permitted":false,"physical_motion_authority":false,"queue_binding":{"item_id":"reviewitem-b380dec46ee13b68a855","queue_id":"reviewqueue-b75d2c9241198e437404","queue_sha256":"fbb5ec19fba2272efa053ca85c974ad9bf6e89ff0dedc6ccdcb72fcd9aa5e357"},"record_state":"generated_draft","schema_version":"myactuator-evidence-intake-packet/1","source_bindings":[{"binding_id":"intakesource-339b89c559e7d3ecc87e","candidate_only":true,"local_path":"assets/vendor/myactuator/FL-FLO/FL-50-15/vendor/FL-50-15-霍尔-250403/FL-50-15-霍尔.STEP","occurrence_id":"step-2c22da519db7b7083d85","redistribution_authority":false,"sha256":"94ca843a36a43bca2e2a90e68d20639b5a935ca035df0bf9d7834cf8b75f0f71","source_kind":"vendor_step"},{"binding_id":"intakesource-9da350e8c80bcff0875d","candidate_only":true,"local_path":"generated/myactuator/cad/flattened_review_packets/step-2c22da519db7b7083d85/packet.json","occurrence_id":"step-2c22da519db7b7083d85","redistribution_authority":false,"sha256":"c9c41d609985b8006025d8dd77b86bb8011f40ff94b10410334678d01111d6f6","source_kind":"review_packet"},{"binding_id":"intakesource-ff3ed717d89afb372235","candidate_only":true,"local_path":"generated/myactuator/cad/flattened_review_packets/step-2c22da519db7b7083d85/overview.png","occurrence_id":"step-2c22da519db7b7083d85:overview","redistribution_authority":false,"sha256":"b08b587f687b40b9d0dfb30b865a2325918b3ff607097df82ee32145093bffde","source_kind":"review_image"},{"binding_id":"intakesource-de47bd9ff643d010c933","candidate_only":true,"local_path":"generated/myactuator/cad/flattened_review_packets/step-2c22da519db7b7083d85/largest-component-sheet.png","occurrence_id":"step-2c22da519db7b7083d85:sheet","redistribution_authority":false,"sha256":"8956d073f2c46b38125c3bc3649c29a886607a906b14e7dbbc7e9d6e8e3fedbb","source_kind":"review_image"}],"subject":{"configuration_id":"cadcfg-66960955bdd6fa1dd307","model":"FL-50-15","package_revision":null,"series":"FL-FLO","subject_id":"cadcfg-66960955bdd6fa1dd307","variant_id":"step-2c22da519db7b7083d85"},"support_granted":false,"tasks":[{"candidate_evidence_refs":[],"candidate_source_ids":["intakesource-339b89c559e7d3ecc87e","intakesource-9da350e8c80bcff0875d","intakesource-ff3ed717d89afb372235","intakesource-de47bd9ff643d010c933"],"canonical_unit":null,"current_state":"unanswered","prompt":"Which exact occurrences, components or reviewed face partition form the fixed housing?","required_evidence_class":"independent_geometry_review","response":null,"response_evidence_refs":[],"task_id":"CADQ-HOUSING","task_kind":"cad_question"},{"candidate_evidence_refs":[],"candidate_source_ids":["intakesource-339b89c559e7d3ecc87e","intakesource-9da350e8c80bcff0875d","intakesource-ff3ed717d89afb372235","intakesource-de47bd9ff643d010c933"],"canonical_unit":null,"current_state":"unanswered","prompt":"Which exact occurrences, components or reviewed face partition form the rotating output?","required_evidence_class":"independent_geometry_review","response":null,"response_evidence_refs":[],"task_id":"CADQ-OUTPUT","task_kind":"cad_question"},{"candidate_evidence_refs":[],"candidate_source_ids":["intakesource-339b89c559e7d3ecc87e","intakesource-9da350e8c80bcff0875d","intakesource-ff3ed717d89afb372235","intakesource-de47bd9ff643d010c933"],"canonical_unit":null,"current_state":"unanswered","prompt":"What is the explicit disposition of every source member not assigned to housing or output?","required_evidence_class":"independent_geometry_review","response":null,"response_evidence_refs":[],"task_id":"CADQ-RESIDUAL","task_kind":"cad_question"},{"candidate_evidence_refs":[],"candidate_source_ids":["intakesource-339b89c559e7d3ecc87e","intakesource-9da350e8c80bcff0875d","intakesource-ff3ed717d89afb372235","intakesource-de47bd9ff643d010c933"],"canonical_unit":null,"current_state":"unanswered","prompt":"What source length unit and exact scale-to-metre transform are evidenced?","required_evidence_class":"independent_geometry_review","response":null,"response_evidence_refs":[],"task_id":"CADQ-UNIT","task_kind":"cad_question"},{"candidate_evidence_refs":[],"candidate_source_ids":["intakesource-339b89c559e7d3ecc87e","intakesource-9da350e8c80bcff0875d","intakesource-ff3ed717d89afb372235","intakesource-de47bd9ff643d010c933"],"canonical_unit":null,"current_state":"unanswered","prompt":"What rigid source-to-canonical transform is evidenced?","required_evidence_class":"independent_geometry_review","response":null,"response_evidence_refs":[],"task_id":"CADQ-FRAME","task_kind":"cad_question"},{"candidate_evidence_refs":[],"candidate_source_ids":["intakesource-339b89c559e7d3ecc87e","intakesource-9da350e8c80bcff0875d","intakesource-ff3ed717d89afb372235","intakesource-de47bd9ff643d010c933"],"canonical_unit":null,"current_state":"unanswered","prompt":"What physical output axis is evidenced and in which source frame is it expressed?","required_evidence_class":"independent_geometry_review","response":null,"response_evidence_refs":[],"task_id":"CADQ-AXIS","task_kind":"cad_question"},{"candidate_evidence_refs":[],"candidate_source_ids":["intakesource-339b89c559e7d3ecc87e","intakesource-9da350e8c80bcff0875d","intakesource-ff3ed717d89afb372235","intakesource-de47bd9ff643d010c933"],"canonical_unit":null,"current_state":"unanswered","prompt":"What physical reference plane or feature defines the output-joint origin?","required_evidence_class":"independent_geometry_review","response":null,"response_evidence_refs":[],"task_id":"CADQ-ORIGIN","task_kind":"cad_question"},{"candidate_evidence_refs":[],"candidate_source_ids":["intakesource-339b89c559e7d3ecc87e","intakesource-9da350e8c80bcff0875d","intakesource-ff3ed717d89afb372235","intakesource-de47bd9ff643d010c933"],"canonical_unit":null,"current_state":"unanswered","prompt":"What physical assembly pose defines zero output angle?","required_evidence_class":"independent_geometry_review","response":null,"response_evidence_refs":[],"task_id":"CADQ-ZERO","task_kind":"cad_question"},{"candidate_evidence_refs":[],"candidate_source_ids":["intakesource-339b89c559e7d3ecc87e","intakesource-9da350e8c80bcff0875d","intakesource-ff3ed717d89afb372235","intakesource-de47bd9ff643d010c933"],"canonical_unit":null,"current_state":"unanswered","prompt":"What evidence defines positive output rotation and its motor/encoder sign relation?","required_evidence_class":"independent_geometry_review","response":null,"response_evidence_refs":[],"task_id":"CADQ-DIRECTION","task_kind":"cad_question"},{"candidate_evidence_refs":[],"candidate_source_ids":["intakesource-339b89c559e7d3ecc87e","intakesource-9da350e8c80bcff0875d","intakesource-ff3ed717d89afb372235","intakesource-de47bd9ff643d010c933"],"canonical_unit":null,"current_state":"unanswered","prompt":"Does the housing remain fixed while only the complete output group articulates over the reviewed range?","required_evidence_class":"independent_geometry_review","response":null,"response_evidence_refs":[],"task_id":"CADQ-ARTICULATION","task_kind":"cad_question"},{"candidate_evidence_refs":[],"candidate_source_ids":["intakesource-339b89c559e7d3ecc87e","intakesource-9da350e8c80bcff0875d","intakesource-ff3ed717d89afb372235","intakesource-de47bd9ff643d010c933"],"canonical_unit":null,"current_state":"unanswered","prompt":"What visual/collision topology, healing and simplification decisions are acceptable?","required_evidence_class":"independent_geometry_review","response":null,"response_evidence_refs":[],"task_id":"CADQ-MESH","task_kind":"cad_question"},{"candidate_evidence_refs":[],"candidate_source_ids":["intakesource-339b89c559e7d3ecc87e","intakesource-9da350e8c80bcff0875d","intakesource-ff3ed717d89afb372235","intakesource-de47bd9ff643d010c933"],"canonical_unit":null,"current_state":"unanswered","prompt":"What qualified source establishes mass, center of mass and inertia for each link?","required_evidence_class":"qualified_mass_property_source","response":null,"response_evidence_refs":[],"task_id":"CADQ-MASS","task_kind":"cad_question"},{"candidate_evidence_refs":[],"candidate_source_ids":["intakesource-339b89c559e7d3ecc87e","intakesource-9da350e8c80bcff0875d","intakesource-ff3ed717d89afb372235","intakesource-de47bd9ff643d010c933"],"canonical_unit":null,"current_state":"unanswered","prompt":"What license or vendor permission governs local and redistributed derived assets?","required_evidence_class":"license_or_vendor_permission","response":null,"response_evidence_refs":[],"task_id":"CADQ-LICENSE","task_kind":"cad_question"}],"workflow":{"assigned":false,"assignment_role_ids":["cad_geometry_reviewer","cad_license_owner"],"controlled_output_directory":"assets/myactuator/cad_decisions","next_action":"Use a specialized component-partition workbench or obtain a better native assembly.","output_schema":"schemas/myactuator-cad-review-decision.schema.json","readiness":"source_or_partition_needed","submission_preconditions":["Resolve every packet task with exact evidence; blocked lanes first require an independently reviewed partition or replacement native assembly.","Generate a candidate hypothesis and export report before constructing a semantic decision.","Validate the resulting submitted decision with tools/manage_cad_review_decisions.py."]}}
