{"accepted":false,"authority":"handoff_navigation_and_draft_scaffolding_only","blocker_ids":["CADQ-HOUSING","CADQ-OUTPUT","CADQ-RESIDUAL","CADQ-UNIT","CADQ-FRAME","CADQ-AXIS","CADQ-ORIGIN","CADQ-ZERO","CADQ-DIRECTION","CADQ-ARTICULATION","CADQ-MESH","CADQ-MASS","CADQ-LICENSE"],"integrity":{"record_sha256":"618d6b7733e5ef7ede5858d790b050f8c2e84d1764330976066d6b0f92939b8e"},"packet_id":"intakepacket-e8ac73bece18358ae087","packet_kind":"cad_semantic_review","physical_action_permitted":false,"physical_motion_authority":false,"queue_binding":{"item_id":"reviewitem-f5140b79dea852423e77","queue_id":"reviewqueue-b75d2c9241198e437404","queue_sha256":"fbb5ec19fba2272efa053ca85c974ad9bf6e89ff0dedc6ccdcb72fcd9aa5e357"},"record_state":"generated_draft","schema_version":"myactuator-evidence-intake-packet/1","source_bindings":[{"binding_id":"intakesource-b80026ccfbec8179e481","candidate_only":true,"local_path":"assets/vendor/myactuator/FL-FLO/FL-85-23/vendor/FL-85-23-251119/FL-85-23-.STEP","occurrence_id":"step-ca8c0d17fec01e9e7992","redistribution_authority":false,"sha256":"33725d57b8e3f86c7783a08eb8c29e5a850fd942e0afd61cd5c49ed40318beab","source_kind":"vendor_step"},{"binding_id":"intakesource-5d83d9eaec373f61a4be","candidate_only":true,"local_path":"generated/myactuator/cad/flattened_review_packets/step-ca8c0d17fec01e9e7992/packet.json","occurrence_id":"step-ca8c0d17fec01e9e7992","redistribution_authority":false,"sha256":"b974d566d9a71f16b15dc1193af1c9cfce8c39cde388ba05e0743b3aa540563e","source_kind":"review_packet"},{"binding_id":"intakesource-e6d35617fbebdc2af0b7","candidate_only":true,"local_path":"generated/myactuator/cad/flattened_review_packets/step-ca8c0d17fec01e9e7992/overview.png","occurrence_id":"step-ca8c0d17fec01e9e7992:overview","redistribution_authority":false,"sha256":"9916e2e54f9e6e2f1adad6dc151d947daff11f24bc433dc08d738c1fd4186f11","source_kind":"review_image"},{"binding_id":"intakesource-a2510f521008f0eff9ec","candidate_only":true,"local_path":"generated/myactuator/cad/flattened_review_packets/step-ca8c0d17fec01e9e7992/largest-component-sheet.png","occurrence_id":"step-ca8c0d17fec01e9e7992:sheet","redistribution_authority":false,"sha256":"0334817f3fd8ba99a9363cae49d3a7091e900069e1854c7e311d220d8510bdf3","source_kind":"review_image"}],"subject":{"configuration_id":"cadcfg-1ddca7989a9967c464c2","model":"FL-85-23","package_revision":null,"series":"FL-FLO","subject_id":"cadcfg-1ddca7989a9967c464c2","variant_id":"step-ca8c0d17fec01e9e7992"},"support_granted":false,"tasks":[{"candidate_evidence_refs":[],"candidate_source_ids":["intakesource-b80026ccfbec8179e481","intakesource-5d83d9eaec373f61a4be","intakesource-e6d35617fbebdc2af0b7","intakesource-a2510f521008f0eff9ec"],"canonical_unit":null,"current_state":"unanswered","prompt":"Which exact occurrences, components or reviewed face partition form the fixed housing?","required_evidence_class":"independent_geometry_review","response":null,"response_evidence_refs":[],"task_id":"CADQ-HOUSING","task_kind":"cad_question"},{"candidate_evidence_refs":[],"candidate_source_ids":["intakesource-b80026ccfbec8179e481","intakesource-5d83d9eaec373f61a4be","intakesource-e6d35617fbebdc2af0b7","intakesource-a2510f521008f0eff9ec"],"canonical_unit":null,"current_state":"unanswered","prompt":"Which exact occurrences, components or reviewed face partition form the rotating output?","required_evidence_class":"independent_geometry_review","response":null,"response_evidence_refs":[],"task_id":"CADQ-OUTPUT","task_kind":"cad_question"},{"candidate_evidence_refs":[],"candidate_source_ids":["intakesource-b80026ccfbec8179e481","intakesource-5d83d9eaec373f61a4be","intakesource-e6d35617fbebdc2af0b7","intakesource-a2510f521008f0eff9ec"],"canonical_unit":null,"current_state":"unanswered","prompt":"What is the explicit disposition of every source member not assigned to housing or output?","required_evidence_class":"independent_geometry_review","response":null,"response_evidence_refs":[],"task_id":"CADQ-RESIDUAL","task_kind":"cad_question"},{"candidate_evidence_refs":[],"candidate_source_ids":["intakesource-b80026ccfbec8179e481","intakesource-5d83d9eaec373f61a4be","intakesource-e6d35617fbebdc2af0b7","intakesource-a2510f521008f0eff9ec"],"canonical_unit":null,"current_state":"unanswered","prompt":"What source length unit and exact scale-to-metre transform are evidenced?","required_evidence_class":"independent_geometry_review","response":null,"response_evidence_refs":[],"task_id":"CADQ-UNIT","task_kind":"cad_question"},{"candidate_evidence_refs":[],"candidate_source_ids":["intakesource-b80026ccfbec8179e481","intakesource-5d83d9eaec373f61a4be","intakesource-e6d35617fbebdc2af0b7","intakesource-a2510f521008f0eff9ec"],"canonical_unit":null,"current_state":"unanswered","prompt":"What rigid source-to-canonical transform is evidenced?","required_evidence_class":"independent_geometry_review","response":null,"response_evidence_refs":[],"task_id":"CADQ-FRAME","task_kind":"cad_question"},{"candidate_evidence_refs":[],"candidate_source_ids":["intakesource-b80026ccfbec8179e481","intakesource-5d83d9eaec373f61a4be","intakesource-e6d35617fbebdc2af0b7","intakesource-a2510f521008f0eff9ec"],"canonical_unit":null,"current_state":"unanswered","prompt":"What physical output axis is evidenced and in which source frame is it expressed?","required_evidence_class":"independent_geometry_review","response":null,"response_evidence_refs":[],"task_id":"CADQ-AXIS","task_kind":"cad_question"},{"candidate_evidence_refs":[],"candidate_source_ids":["intakesource-b80026ccfbec8179e481","intakesource-5d83d9eaec373f61a4be","intakesource-e6d35617fbebdc2af0b7","intakesource-a2510f521008f0eff9ec"],"canonical_unit":null,"current_state":"unanswered","prompt":"What physical reference plane or feature defines the output-joint origin?","required_evidence_class":"independent_geometry_review","response":null,"response_evidence_refs":[],"task_id":"CADQ-ORIGIN","task_kind":"cad_question"},{"candidate_evidence_refs":[],"candidate_source_ids":["intakesource-b80026ccfbec8179e481","intakesource-5d83d9eaec373f61a4be","intakesource-e6d35617fbebdc2af0b7","intakesource-a2510f521008f0eff9ec"],"canonical_unit":null,"current_state":"unanswered","prompt":"What physical assembly pose defines zero output angle?","required_evidence_class":"independent_geometry_review","response":null,"response_evidence_refs":[],"task_id":"CADQ-ZERO","task_kind":"cad_question"},{"candidate_evidence_refs":[],"candidate_source_ids":["intakesource-b80026ccfbec8179e481","intakesource-5d83d9eaec373f61a4be","intakesource-e6d35617fbebdc2af0b7","intakesource-a2510f521008f0eff9ec"],"canonical_unit":null,"current_state":"unanswered","prompt":"What evidence defines positive output rotation and its motor/encoder sign relation?","required_evidence_class":"independent_geometry_review","response":null,"response_evidence_refs":[],"task_id":"CADQ-DIRECTION","task_kind":"cad_question"},{"candidate_evidence_refs":[],"candidate_source_ids":["intakesource-b80026ccfbec8179e481","intakesource-5d83d9eaec373f61a4be","intakesource-e6d35617fbebdc2af0b7","intakesource-a2510f521008f0eff9ec"],"canonical_unit":null,"current_state":"unanswered","prompt":"Does the housing remain fixed while only the complete output group articulates over the reviewed range?","required_evidence_class":"independent_geometry_review","response":null,"response_evidence_refs":[],"task_id":"CADQ-ARTICULATION","task_kind":"cad_question"},{"candidate_evidence_refs":[],"candidate_source_ids":["intakesource-b80026ccfbec8179e481","intakesource-5d83d9eaec373f61a4be","intakesource-e6d35617fbebdc2af0b7","intakesource-a2510f521008f0eff9ec"],"canonical_unit":null,"current_state":"unanswered","prompt":"What visual/collision topology, healing and simplification decisions are acceptable?","required_evidence_class":"independent_geometry_review","response":null,"response_evidence_refs":[],"task_id":"CADQ-MESH","task_kind":"cad_question"},{"candidate_evidence_refs":[],"candidate_source_ids":["intakesource-b80026ccfbec8179e481","intakesource-5d83d9eaec373f61a4be","intakesource-e6d35617fbebdc2af0b7","intakesource-a2510f521008f0eff9ec"],"canonical_unit":null,"current_state":"unanswered","prompt":"What qualified source establishes mass, center of mass and inertia for each link?","required_evidence_class":"qualified_mass_property_source","response":null,"response_evidence_refs":[],"task_id":"CADQ-MASS","task_kind":"cad_question"},{"candidate_evidence_refs":[],"candidate_source_ids":["intakesource-b80026ccfbec8179e481","intakesource-5d83d9eaec373f61a4be","intakesource-e6d35617fbebdc2af0b7","intakesource-a2510f521008f0eff9ec"],"canonical_unit":null,"current_state":"unanswered","prompt":"What license or vendor permission governs local and redistributed derived assets?","required_evidence_class":"license_or_vendor_permission","response":null,"response_evidence_refs":[],"task_id":"CADQ-LICENSE","task_kind":"cad_question"}],"workflow":{"assigned":false,"assignment_role_ids":["cad_geometry_reviewer","cad_license_owner"],"controlled_output_directory":"assets/myactuator/cad_decisions","next_action":"Obtain a solid/native assembly or submit independently reviewed healing evidence before semantic partition.","output_schema":"schemas/myactuator-cad-review-decision.schema.json","readiness":"source_or_partition_needed","submission_preconditions":["Resolve every packet task with exact evidence; blocked lanes first require an independently reviewed partition or replacement native assembly.","Generate a candidate hypothesis and export report before constructing a semantic decision.","Validate the resulting submitted decision with tools/manage_cad_review_decisions.py."]}}
